<?xml version="1.0" encoding="UTF-8"?>
<Hospital xmlns:xsi="http://www.w3.org/2001/XMLSchema-instance"
          xsi:noNamespaceSchemaLocation="question13a.xsd">

  <Patient>
    <PatientNumber>12345</PatientNumber>
    <Name>
      <FirstName>Ridesh</FirstName>
      <LastName>Maharjan</LastName>
    </Name>
    <DoctorName>Dr. Pushpa Kamal Dahal</DoctorName>
    <Diseases>
      <Disease>Diabetes</Disease>
      <Disease>Blood Pressure</Disease>
    </Diseases>
    <ConsultationCharge>1200</ConsultationCharge>
    <LabTests>
      <Test>Blood Test</Test>
      <Test>ECG</Test>
    </LabTests>
  </Patient>

  <Patient>
    <PatientNumber>67890</PatientNumber>
    <Name>
      <FirstName>Sakar</FirstName>
      <MiddleName>Bahadur</MiddleName>
      <LastName>Shahi</LastName>
    </Name>
    <DoctorName>Dr. Narendra Bahadur</DoctorName>
    <Diseases>
      <Disease>Asthma</Disease>
    </Diseases>
    <ConsultationCharge>900</ConsultationCharge>
    <LabTests>
      <Test>X-Ray</Test>
    </LabTests>
  </Patient>

</Hospital>
